{
  "schema": "film.film-style-recipe@1",
  "id": "org.local.verified-baseline",
  "revision": "r1",
  "title": "Test baseline",
  "description": "Compiler test Recipe; not one of the three spike Cuts.",
  "scope": "organization",
  "owner": "local",
  "lineage": null,
  "capabilities": [
    {
      "slot": "layout",
      "ref": {
        "id": "film.layout.full-frame",
        "version": "1.0.0",
        "digest": "sha256:9edc650d4d0d2eef9f721eb64a79bcc76292a7b1cf7df51e8468f54ffaf24f83"
      }
    },
    {
      "slot": "motion",
      "ref": {
        "id": "film.motion.slow-camera",
        "version": "1.0.0",
        "digest": "sha256:53b103fce42146e448f59d3e22b76181d31486a19c361b2bec87f9a0d6a9783f"
      }
    },
    {
      "slot": "transition",
      "ref": {
        "id": "film.transition.dissolve",
        "version": "1.0.0",
        "digest": "sha256:00ab950258e10288d4ada415ae36b7dd151ff676636ca2e23379ed65685b755b"
      }
    },
    {
      "slot": "typography",
      "ref": {
        "id": "film.typography.subtitle",
        "version": "1.0.0",
        "digest": "sha256:e55cca7a9403b65ca7c2f79e672e3b41226d6208a384f980e15f54a9b1950a91"
      }
    },
    {
      "slot": "sound",
      "ref": {
        "id": "film.sound.ambience-led",
        "version": "1.0.0",
        "digest": "sha256:85820a2d0393775b4d97a1cc31e2b2833187106363350341062cea177158d797"
      }
    },
    {
      "slot": "surface",
      "ref": {
        "id": "film.surface.soft-vignette",
        "version": "1.0.0",
        "digest": "sha256:13ba7dd0ed50bee59be1fbfc92d434ee4dffb2e0d9e93513520b9ceab2838ba2"
      }
    }
  ],
  "effects": [
    {
      "id": "film.effect.light-leak",
      "version": "1.0.0",
      "digest": "sha256:5a93529e945af6393f291edca44ed289e3f32402f9835188043bf723e13e6968"
    }
  ],
  "params": {},
  "fonts": [
    {
      "role": "caption",
      "ref": {
        "id": "font.noto-serif-jp",
        "version": "1.0.0",
        "digest": "sha256:e1fbbd028eca1fe001795e46ad03120433c5e083be31a87a23fa6173b855e8e6"
      }
    },
    {
      "role": "title",
      "ref": {
        "id": "font.noto-serif-jp",
        "version": "1.0.0",
        "digest": "sha256:e1fbbd028eca1fe001795e46ad03120433c5e083be31a87a23fa6173b855e8e6"
      }
    }
  ],
  "palette": {
    "family": "warm-film",
    "background": "#101014",
    "text": "#f6f1e7",
    "accent": "#e8b26a",
    "scrim": "#000000"
  },
  "curves": {
    "energy": 0.3,
    "intimacy": 0.6,
    "openness": 0.5,
    "warmth": 0.6,
    "stillness": 0.7
  },
  "timing": {
    "preferredSceneMs": 7000,
    "minSceneMs": 2500,
    "maxSceneMs": 14000,
    "minHoldMs": 1500,
    "beatQuantized": false
  },
  "chapterAllowlist": [
    {
      "field": "pacing",
      "min": 0.8,
      "max": 1.25
    },
    {
      "field": "motionAmount",
      "min": 0,
      "max": 0.8
    },
    {
      "field": "emphasis",
      "min": 0,
      "max": 1
    },
    {
      "field": "sfxLevel",
      "min": 0,
      "max": 1
    },
    {
      "field": "visualIntensity",
      "min": 0,
      "max": 1
    }
  ],
  "output": {
    "profile": "landscape-1080p30@1"
  }
}
